10:15:32.123456 IP 192.168.1.10.54321 > 142.250.80.14.443: Flags [S], seq 123456789, win 65535, length 0
10:15:32.124567 IP 142.250.80.14.443 > 192.168.1.10.54321: Flags [S.], seq 987654321, ack 123456790, win 65535, length 0
10:15:32.124890 IP 192.168.1.10.54321 > 142.250.80.14.443: Flags [.], ack 987654322, win 65535, length 0
10:15:33.001234 IP 192.168.1.10.54321 > 142.250.80.14.443: Flags [P.], seq 123456790:123456850, ack 987654322, win 65535, length 60
10:15:33.002345 IP 142.250.80.14.443 > 192.168.1.10.54321: Flags [.], ack 123456850, win 65535, length 0
10:15:33.050001 ARP, Request who-has 192.168.1.1 tell 192.168.1.10, length 46
10:15:33.050100 ARP, Reply 192.168.1.1 is-at aa:bb:cc:dd:ee:ff, length 46
10:15:34.000001 IP 10.0.0.50.22 > 192.168.1.10.33000: Flags [P.], seq 100:200, ack 300, win 65535, length 100
10:15:34.000050 IP 192.168.1.10.33000 > 10.0.0.50.22: Flags [.], ack 200, win 65535, length 0
10:15:35.123456 IP 203.0.113.5.45678 > 192.168.1.10.22: Flags [S], seq 111111, win 65535, length 0
10:15:35.123500 IP 192.168.1.10.22 > 203.0.113.5.45678: Flags [R.], seq 0, ack 111112, win 0, length 0
10:15:36.000000 IP 10.0.0.50.22 > 192.168.1.10.33000: Flags [P.], seq 200:250, ack 300, win 65535, length 50
10:15:36.001000 IP 192.168.1.10.33000 > 10.0.0.50.22: Flags [F.], seq 300, ack 250, win 65535, length 0
10:15:36.002000 IP 10.0.0.50.22 > 192.168.1.10.33000: Flags [F.], seq 250, ack 301, win 65535, length 0
10:15:36.003000 IP 192.168.1.10.33000 > 10.0.0.50.22: Flags [.], ack 251, win 65535, length 0
